[
  {
    "id": "bus-agent-security",
    "name": "Bus Agent Security",
    "plugin_name": "bus-agent-security",
    "description": "AI agent systems security, LLM threat modeling, MCP server reviews, and injection defense",
    "job": "AI agent systems security, LLM threat modeling, MCP server reviews, and injection defense",
    "skill_count": 6,
    "skills": [
      "agent-security-audit",
      "llm-risk-assess",
      "agentic-ai-risk-assess",
      "mcp-server-review",
      "prompt-injection-test",
      "multi-agentic-threat-model"
    ],
    "recommended_with": [
      "bus-secure-app-builder",
      "bus-security-auditor"
    ],
    "runtime_rules": []
  },
  {
    "id": "bus-android-app-builder",
    "name": "Bus Android App Builder",
    "plugin_name": "bus-android-app-builder",
    "description": "Native Android app engineering with Jetpack Compose, edge-to-edge, and Play policy compliance",
    "job": "Native Android app engineering with Jetpack Compose, edge-to-edge, and Play policy compliance",
    "skill_count": 6,
    "skills": [
      "android-cli",
      "edge-to-edge",
      "play-policy-insights",
      "android-intent-security",
      "camerax",
      "agp-9-upgrade"
    ],
    "recommended_with": [
      "bus-engineering-core",
      "bus-secure-app-builder"
    ],
    "runtime_rules": []
  },
  {
    "id": "bus-audit-release",
    "name": "Bus Audit Release",
    "plugin_name": "bus-audit-release",
    "description": "Universal release gate, multi-perspective code review, browser QA, and final verification",
    "job": "Universal release gate, multi-perspective code review, browser QA, and final verification",
    "skill_count": 13,
    "skills": [
      "code-review-and-quality",
      "verification-before-completion",
      "impeccable",
      "web-quality-audit",
      "audit-context-building",
      "supply-chain-risk-auditor",
      "ce-code-review",
      "ce-test-browser",
      "ce-test-xcode",
      "ce-polish",
      "ce-dogfood",
      "ce-optimize",
      "ce-simplify-code"
    ],
    "recommended_with": [
      "bus-engineering-core"
    ],
    "runtime_rules": []
  },
  {
    "id": "bus-backend-api-data",
    "name": "Bus Backend Api Data",
    "plugin_name": "bus-backend-api-data",
    "description": "Backend engineering, API design, observability, and PostgreSQL/Supabase data architecture",
    "job": "Backend engineering, API design, observability, and PostgreSQL/Supabase data architecture",
    "skill_count": 6,
    "skills": [
      "source-driven-development",
      "api-and-interface-design",
      "code-review-and-quality",
      "observability-and-instrumentation",
      "supabase-postgres-best-practices",
      "supabase"
    ],
    "recommended_with": [
      "bus-engineering-core",
      "bus-secure-app-builder"
    ],
    "runtime_rules": []
  },
  {
    "id": "bus-engineering-core",
    "name": "Bus Engineering Core",
    "plugin_name": "bus-engineering-core",
    "description": "Core software engineering workflows, test-driven development, and systematic debugging",
    "job": "Core software engineering workflows, test-driven development, and systematic debugging",
    "skill_count": 7,
    "skills": [
      "brainstorming",
      "writing-plans",
      "test-driven-development",
      "systematic-debugging",
      "requesting-code-review",
      "verification-before-completion",
      "subagent-driven-development"
    ],
    "recommended_with": [
      "bus-secure-app-builder",
      "bus-audit-release"
    ],
    "runtime_rules": []
  },
  {
    "id": "bus-expo-app-builder",
    "name": "Bus Expo App Builder",
    "plugin_name": "bus-expo-app-builder",
    "description": "Universal React Native / Expo mobile development, native UI, router, and fluid motion",
    "job": "Universal React Native / Expo mobile development, native UI, router, and fluid motion",
    "skill_count": 9,
    "skills": [
      "expo-project-structure",
      "expo-router",
      "expo-native-ui",
      "expo-ui",
      "expo-data-fetching",
      "expo-design-system",
      "expo-dev-client",
      "expo-module",
      "expo-upgrade"
    ],
    "recommended_with": [
      "bus-product-ui-taste",
      "bus-secure-app-builder"
    ],
    "runtime_rules": [
      "expo-project-structure + expo-native-ui + expo-design-system + relevant router/data skill",
      "Companion: animate-expo"
    ]
  },
  {
    "id": "bus-flutter-app-builder",
    "name": "Bus Flutter App Builder",
    "plugin_name": "bus-flutter-app-builder",
    "description": "Cross-platform mobile application development with Flutter, Dart unit tests, and widget tests",
    "job": "Cross-platform mobile application development with Flutter, Dart unit tests, and widget tests",
    "skill_count": 9,
    "skills": [
      "flutter-add-widget-preview",
      "flutter-add-widget-test",
      "flutter-add-integration-test",
      "dart-run-static-analysis",
      "dart-add-unit-test",
      "dart-collect-coverage",
      "dart-fix-runtime-errors",
      "dart-generate-test-mocks",
      "dart-resolve-package-conflicts"
    ],
    "recommended_with": [
      "bus-engineering-core",
      "bus-secure-app-builder"
    ],
    "runtime_rules": [
      "flutter-add-widget-test + dart-run-static-analysis + relevant implementation skill + verification-before-completion",
      "Validate Android and iOS targets separately"
    ]
  },
  {
    "id": "bus-flutter-desktop-builder",
    "name": "Bus Flutter Desktop Builder",
    "plugin_name": "bus-flutter-desktop-builder",
    "description": "Cross-platform desktop application development with Flutter and Dart analysis",
    "job": "Cross-platform desktop application development with Flutter and Dart analysis",
    "skill_count": 9,
    "skills": [
      "flutter-add-widget-preview",
      "flutter-add-widget-test",
      "flutter-add-integration-test",
      "dart-run-static-analysis",
      "dart-add-unit-test",
      "dart-collect-coverage",
      "dart-fix-runtime-errors",
      "dart-generate-test-mocks",
      "dart-resolve-package-conflicts"
    ],
    "recommended_with": [
      "bus-engineering-core",
      "bus-audit-release"
    ],
    "runtime_rules": [
      "flutter-add-widget-test + dart-run-static-analysis + relevant implementation skill + verification-before-completion"
    ]
  },
  {
    "id": "bus-ios-app-builder",
    "name": "Bus Ios App Builder",
    "plugin_name": "bus-ios-app-builder",
    "description": "Native iOS development with SwiftUI, simulator inspection, debugger workflows, and Liquid Glass",
    "job": "Native iOS development with SwiftUI, simulator inspection, debugger workflows, and Liquid Glass",
    "skill_count": 9,
    "skills": [
      "swiftui-ui-patterns",
      "swiftui-view-refactor",
      "ios-debugger-agent",
      "ios-simulator-browser",
      "swiftui-performance-audit",
      "ios-ettrace-performance",
      "ios-memgraph-leaks",
      "swiftui-liquid-glass",
      "ios-app-intents"
    ],
    "recommended_with": [
      "bus-product-ui-taste",
      "bus-audit-release"
    ],
    "runtime_rules": [
      "swiftui-ui-patterns + ios-debugger-agent + ios-simulator-browser + verification-before-completion",
      "Apple HIG remains platform authority"
    ]
  },
  {
    "id": "bus-macos-app-builder",
    "name": "Bus Macos App Builder",
    "plugin_name": "bus-macos-app-builder",
    "description": "Native macOS desktop development with SwiftUI, AppKit, window management, and notarization",
    "job": "Native macOS desktop development with SwiftUI, AppKit, window management, and notarization",
    "skill_count": 9,
    "skills": [
      "build-run-debug",
      "swiftui-patterns",
      "window-management",
      "appkit-interop",
      "view-refactor",
      "test-triage",
      "signing-entitlements",
      "packaging-notarization",
      "telemetry"
    ],
    "recommended_with": [
      "bus-product-ui-taste",
      "bus-audit-release"
    ],
    "runtime_rules": [
      "build-run-debug + swiftui-patterns + test-triage + verification-before-completion",
      "Apple HIG remains platform authority"
    ]
  },
  {
    "id": "bus-product-ui-taste",
    "name": "Bus Product Ui Taste",
    "plugin_name": "bus-product-ui-taste",
    "description": "Product design, craft, motion, UI/UX intelligence, and anti-slop visual critique",
    "job": "Product design, craft, motion, UI/UX intelligence, and anti-slop visual critique",
    "skill_count": 17,
    "skills": [
      "design-taste-frontend",
      "frontend-design",
      "emil-design-eng",
      "apple-design",
      "animate",
      "animate-expo",
      "review-animations",
      "improve-animations",
      "ui-ux-pro-max",
      "impeccable",
      "ui-craft",
      "surface-motion",
      "surface-interaction",
      "surface-typography",
      "system-tokens",
      "system-components",
      "system-patterns"
    ],
    "recommended_with": [
      "bus-web-app-builder",
      "bus-macos-app-builder",
      "bus-ios-app-builder"
    ],
    "runtime_rules": []
  },
  {
    "id": "bus-research-intelligence",
    "name": "Bus Research Intelligence",
    "plugin_name": "bus-research-intelligence",
    "description": "Comprehensive search, deep literature research, and interactive web synthesis",
    "job": "Comprehensive search, deep literature research, and interactive web synthesis",
    "skill_count": 8,
    "skills": [
      "firecrawl-search",
      "deep-research",
      "github-deep-research",
      "academic-paper-review",
      "systematic-literature-review",
      "browser-use",
      "qa",
      "last30days"
    ],
    "recommended_with": [
      "bus-engineering-core"
    ],
    "runtime_rules": [
      "simple lookup -> firecrawl-search",
      "deep research -> firecrawl-search + deep-research",
      "GitHub comparison -> github-deep-research",
      "interactive website -> browser-use",
      "runtime website QA -> qa",
      "recent sentiment -> last30days"
    ]
  },